{
  "task_id": "task-007",
  "stage": "plan",
  "status": "escalated",
  "stages": {
    "spec": {
      "attempts": 1,
      "max_attempts": 3,
      "last_diff_hash": null
    },
    "plan": {
      "attempts": 1,
      "max_attempts": 3,
      "last_diff_hash": null
    },
    "implement": {
      "attempts": 0,
      "max_attempts": 3,
      "last_diff_hash": null
    },
    "test": {
      "attempts": 0,
      "max_attempts": 3,
      "last_diff_hash": null
    },
    "review": {
      "attempts": 0,
      "max_attempts": 3,
      "last_diff_hash": null
    },
    "approve": {
      "attempts": 0,
      "max_attempts": 3,
      "last_diff_hash": null
    },
    "merge": {
      "attempts": 0,
      "max_attempts": 3,
      "last_diff_hash": null
    }
  },
  "budget": {
    "max_total_attempts": 15,
    "max_token_spend": 2000000,
    "total_attempts": 2,
    "tokens_spent": 0
  }
}
