{
  "task_id": "t-fb2",
  "stage": "implement",
  "status": "escalated",
  "last_good_commit": "571651ff816bc662a5eb371336334416da3c16d8",
  "stages": {
    "spec": {
      "attempts": 1,
      "max_attempts": 3,
      "last_diff_hash": null
    },
    "plan": {
      "attempts": 1,
      "max_attempts": 3,
      "last_diff_hash": null
    },
    "implement": {
      "attempts": 2,
      "max_attempts": 3,
      "last_diff_hash": "4ae78d3a209e4feca0509d7a1f9bc0996ef28c9c7cd77c11859a3e3e10c16eec",
      "last_failure": "goal keeper: off track after 'implement' \u2014 violated: scope: README.md is not in the spec's declared scope [\"Create greet.py with greet(name) function that returns 'Hello, <name>!'\", 'Create test_greet.py with test cases for the greet function', 'Ensure both files are in the task working directory (/Users/George/warden/tasks/t-fb2/workdir)'] | the work has drifted from the spec's declared scope"
    },
    "test": {
      "attempts": 2,
      "max_attempts": 3,
      "last_diff_hash": null,
      "last_failure": "could not extract structured artifact from agent output"
    },
    "review": {
      "attempts": 1,
      "max_attempts": 3,
      "last_diff_hash": null
    },
    "approve": {
      "attempts": 0,
      "max_attempts": 3,
      "last_diff_hash": null
    },
    "merge": {
      "attempts": 0,
      "max_attempts": 3,
      "last_diff_hash": null
    }
  },
  "budget": {
    "max_total_attempts": 15,
    "max_token_spend": 2000000,
    "total_attempts": 8,
    "tokens_spent": 9206
  }
}
